{"$schema":"https://json-schema.org/draft/2020-12/schema","additionalProperties":false,"properties":{"$schema":{"const":"https://json-schema.org/draft/2020-12/schema"},"artifact_status":{"const":"draft"},"definitions":{"items":{"additionalProperties":false,"properties":{"case_id":{"pattern":"^PMC-","type":"string"},"case_scope":{"enum":["protocol-executable","policy-projection","runner-self-test"]},"review_rationale":{"maxLength":512,"minLength":1,"type":"string"},"scenario_id":{"pattern":"^[a-z0-9-]+$","type":"string"},"title":{"maxLength":512,"minLength":1,"type":"string"},"vector_class":{"pattern":"^CV-","type":"string"}},"required":["case_id","vector_class","title","case_scope","scenario_id","review_rationale"],"type":"object"},"maxItems":68,"minItems":68,"type":"array"},"license":{"const":"Apache-2.0"},"schema_version":{"const":"0.1"},"suite":{"additionalProperties":false,"properties":{"id":{"const":"private-match-core"},"version":{"const":"0.1"}},"required":["id","version"],"type":"object"}},"required":["$schema","schema_version","artifact_status","suite","definitions","license"],"type":"object"}