{"$schema":"https://json-schema.org/draft/2020-12/schema","artifact_status":"draft","definitions":[{"case_id":"PMC-VALID-END-TO-END-V0-1","case_scope":"protocol-executable","review_rationale":"CV-VALID-END-TO-END is exercised by a closed synthetic fixture through the shared Protocol validator or runner boundary.","scenario_id":"valid-end-to-end","title":"Valid End To End","vector_class":"CV-VALID-END-TO-END"},{"case_id":"PMC-VALID-NO-MATCH-V0-1","case_scope":"protocol-executable","review_rationale":"CV-VALID-NO-MATCH is exercised by a closed synthetic fixture through the shared Protocol validator or runner boundary.","scenario_id":"valid-no-match","title":"Valid No Match","vector_class":"CV-VALID-NO-MATCH"},{"case_id":"PMC-VALID-INDETERMINATE-V0-1","case_scope":"protocol-executable","review_rationale":"CV-VALID-INDETERMINATE is exercised by a closed synthetic fixture through the shared Protocol validator or runner boundary.","scenario_id":"valid-indeterminate","title":"Valid Indeterminate","vector_class":"CV-VALID-INDETERMINATE"},{"case_id":"PMC-VALID-EXACT-DUPLICATE-V0-1","case_scope":"protocol-executable","review_rationale":"CV-VALID-EXACT-DUPLICATE is exercised by a closed synthetic fixture through the shared Protocol validator or runner boundary.","scenario_id":"valid-exact-duplicate","title":"Valid Exact Duplicate","vector_class":"CV-VALID-EXACT-DUPLICATE"},{"case_id":"PMC-VALID-EXPIRY-V0-1","case_scope":"protocol-executable","review_rationale":"CV-VALID-EXPIRY is exercised by a closed synthetic fixture through the shared Protocol validator or runner boundary.","scenario_id":"valid-expiry","title":"Valid Expiry","vector_class":"CV-VALID-EXPIRY"},{"case_id":"PMC-MALFORMED-JSON-V0-1","case_scope":"protocol-executable","review_rationale":"CV-MALFORMED-JSON is exercised by a closed synthetic fixture through the shared Protocol validator or runner boundary.","scenario_id":"malformed-json","title":"Malformed Json","vector_class":"CV-MALFORMED-JSON"},{"case_id":"PMC-DUPLICATE-JSON-KEY-V0-1","case_scope":"protocol-executable","review_rationale":"CV-DUPLICATE-JSON-KEY is exercised by a closed synthetic fixture through the shared Protocol validator or runner boundary.","scenario_id":"duplicate-json-key","title":"Duplicate Json Key","vector_class":"CV-DUPLICATE-JSON-KEY"},{"case_id":"PMC-UNKNOWN-FIELD-V0-1","case_scope":"protocol-executable","review_rationale":"CV-UNKNOWN-FIELD is exercised by a closed synthetic fixture through the shared Protocol validator or runner boundary.","scenario_id":"unknown-field","title":"Unknown Field","vector_class":"CV-UNKNOWN-FIELD"},{"case_id":"PMC-UNKNOWN-VERSION-V0-1","case_scope":"protocol-executable","review_rationale":"CV-UNKNOWN-VERSION is exercised by a closed synthetic fixture through the shared Protocol validator or runner boundary.","scenario_id":"unknown-version","title":"Unknown Version","vector_class":"CV-UNKNOWN-VERSION"},{"case_id":"PMC-NONCANONICAL-JSON-V0-1","case_scope":"protocol-executable","review_rationale":"CV-NONCANONICAL-JSON is exercised by a closed synthetic fixture through the shared Protocol validator or runner boundary.","scenario_id":"noncanonical-json","title":"Noncanonical Json","vector_class":"CV-NONCANONICAL-JSON"},{"case_id":"PMC-INVALID-UNICODE-V0-1","case_scope":"protocol-executable","review_rationale":"CV-INVALID-UNICODE is exercised by a closed synthetic fixture through the shared Protocol validator or runner boundary.","scenario_id":"invalid-unicode","title":"Invalid Unicode","vector_class":"CV-INVALID-UNICODE"},{"case_id":"PMC-NAN-INFINITY-V0-1","case_scope":"protocol-executable","review_rationale":"CV-NAN-INFINITY is exercised by a closed synthetic fixture through the shared Protocol validator or runner boundary.","scenario_id":"nan-infinity","title":"Nan Infinity","vector_class":"CV-NAN-INFINITY"},{"case_id":"PMC-NEGATIVE-ZERO-V0-1","case_scope":"protocol-executable","review_rationale":"CV-NEGATIVE-ZERO is exercised by a closed synthetic fixture through the shared Protocol validator or runner boundary.","scenario_id":"negative-zero","title":"Negative Zero","vector_class":"CV-NEGATIVE-ZERO"},{"case_id":"PMC-UNSAFE-INTEGER-V0-1","case_scope":"protocol-executable","review_rationale":"CV-UNSAFE-INTEGER is exercised by a closed synthetic fixture through the shared Protocol validator or runner boundary.","scenario_id":"unsafe-integer","title":"Unsafe Integer","vector_class":"CV-UNSAFE-INTEGER"},{"case_id":"PMC-PAYLOAD-DIGEST-TAMPER-V0-1","case_scope":"protocol-executable","review_rationale":"CV-PAYLOAD-DIGEST-TAMPER is exercised by a closed synthetic fixture through the shared Protocol validator or runner boundary.","scenario_id":"payload-digest-tamper","title":"Payload Digest Tamper","vector_class":"CV-PAYLOAD-DIGEST-TAMPER"},{"case_id":"PMC-MESSAGE-DIGEST-TAMPER-V0-1","case_scope":"protocol-executable","review_rationale":"CV-MESSAGE-DIGEST-TAMPER is exercised by a closed synthetic fixture through the shared Protocol validator or runner boundary.","scenario_id":"message-digest-tamper","title":"Message Digest Tamper","vector_class":"CV-MESSAGE-DIGEST-TAMPER"},{"case_id":"PMC-WIRE-DIGEST-TAMPER-V0-1","case_scope":"protocol-executable","review_rationale":"CV-WIRE-DIGEST-TAMPER is exercised by a closed synthetic fixture through the shared Protocol validator or runner boundary.","scenario_id":"wire-digest-tamper","title":"Wire Digest Tamper","vector_class":"CV-WIRE-DIGEST-TAMPER"},{"case_id":"PMC-PRIOR-TRANSCRIPT-MISMATCH-V0-1","case_scope":"protocol-executable","review_rationale":"CV-PRIOR-TRANSCRIPT-MISMATCH is exercised by a closed synthetic fixture through the shared Protocol validator or runner boundary.","scenario_id":"prior-transcript-mismatch","title":"Prior Transcript Mismatch","vector_class":"CV-PRIOR-TRANSCRIPT-MISMATCH"},{"case_id":"PMC-TRANSCRIPT-REORDER-V0-1","case_scope":"protocol-executable","review_rationale":"CV-TRANSCRIPT-REORDER is exercised by a closed synthetic fixture through the shared Protocol validator or runner boundary.","scenario_id":"transcript-reorder","title":"Transcript Reorder","vector_class":"CV-TRANSCRIPT-REORDER"},{"case_id":"PMC-TRANSCRIPT-OMISSION-V0-1","case_scope":"protocol-executable","review_rationale":"CV-TRANSCRIPT-OMISSION is exercised by a closed synthetic fixture through the shared Protocol validator or runner boundary.","scenario_id":"transcript-omission","title":"Transcript Omission","vector_class":"CV-TRANSCRIPT-OMISSION"},{"case_id":"PMC-DUPLICATE-TRANSCRIPT-APPEND-V0-1","case_scope":"protocol-executable","review_rationale":"CV-DUPLICATE-TRANSCRIPT-APPEND is exercised by a closed synthetic fixture through the shared Protocol validator or runner boundary.","scenario_id":"duplicate-transcript-append","title":"Duplicate Transcript Append","vector_class":"CV-DUPLICATE-TRANSCRIPT-APPEND"},{"case_id":"PMC-WRONG-PARTICIPANT-V0-1","case_scope":"protocol-executable","review_rationale":"CV-WRONG-PARTICIPANT is exercised by a closed synthetic fixture through the shared Protocol validator or runner boundary.","scenario_id":"wrong-participant","title":"Wrong Participant","vector_class":"CV-WRONG-PARTICIPANT"},{"case_id":"PMC-WRONG-AUDIENCE-V0-1","case_scope":"protocol-executable","review_rationale":"CV-WRONG-AUDIENCE is exercised by a closed synthetic fixture through the shared Protocol validator or runner boundary.","scenario_id":"wrong-audience","title":"Wrong Audience","vector_class":"CV-WRONG-AUDIENCE"},{"case_id":"PMC-WRONG-SESSION-V0-1","case_scope":"protocol-executable","review_rationale":"CV-WRONG-SESSION is exercised by a closed synthetic fixture through the shared Protocol validator or runner boundary.","scenario_id":"wrong-session","title":"Wrong Session","vector_class":"CV-WRONG-SESSION"},{"case_id":"PMC-WRONG-POLICY-V0-1","case_scope":"protocol-executable","review_rationale":"CV-WRONG-POLICY is exercised by a closed synthetic fixture through the shared Protocol validator or runner boundary.","scenario_id":"wrong-policy","title":"Wrong Policy","vector_class":"CV-WRONG-POLICY"},{"case_id":"PMC-WRONG-PROFILE-V0-1","case_scope":"protocol-executable","review_rationale":"CV-WRONG-PROFILE is exercised by a closed synthetic fixture through the shared Protocol validator or runner boundary.","scenario_id":"wrong-profile","title":"Wrong Profile","vector_class":"CV-WRONG-PROFILE"},{"case_id":"PMC-WRONG-ATTEMPT-V0-1","case_scope":"protocol-executable","review_rationale":"CV-WRONG-ATTEMPT is exercised by a closed synthetic fixture through the shared Protocol validator or runner boundary.","scenario_id":"wrong-attempt","title":"Wrong Attempt","vector_class":"CV-WRONG-ATTEMPT"},{"case_id":"PMC-WRONG-COMMITMENT-PAIR-V0-1","case_scope":"protocol-executable","review_rationale":"CV-WRONG-COMMITMENT-PAIR is exercised by a closed synthetic fixture through the shared Protocol validator or runner boundary.","scenario_id":"wrong-commitment-pair","title":"Wrong Commitment Pair","vector_class":"CV-WRONG-COMMITMENT-PAIR"},{"case_id":"PMC-DUPLICATE-CONFLICT-V0-1","case_scope":"protocol-executable","review_rationale":"CV-DUPLICATE-CONFLICT is exercised by a closed synthetic fixture through the shared Protocol validator or runner boundary.","scenario_id":"duplicate-conflict","title":"Duplicate Conflict","vector_class":"CV-DUPLICATE-CONFLICT"},{"case_id":"PMC-NONCE-REUSE-V0-1","case_scope":"protocol-executable","review_rationale":"CV-NONCE-REUSE is exercised by a closed synthetic fixture through the shared Protocol validator or runner boundary.","scenario_id":"nonce-reuse","title":"Nonce Reuse","vector_class":"CV-NONCE-REUSE"},{"case_id":"PMC-STALE-SEQUENCE-V0-1","case_scope":"protocol-executable","review_rationale":"CV-STALE-SEQUENCE is exercised by a closed synthetic fixture through the shared Protocol validator or runner boundary.","scenario_id":"stale-sequence","title":"Stale Sequence","vector_class":"CV-STALE-SEQUENCE"},{"case_id":"PMC-OUT-OF-ORDER-V0-1","case_scope":"protocol-executable","review_rationale":"CV-OUT-OF-ORDER i